{"baseline_state":{"alpha":1.0,"arrays":"baseline-state-seed-20261024.0067290bc78b8f5f.npz","arrays_sha256":"0067290bc78b8f5f66846d2c6ee3564023bc3c4a9bfa01dd443c03d07ba5a85e","event_vocabulary":["api_interface_modified","dependency_upgraded","compatibility_checked","ci_failed","bug_fixed","integration_test_passed","review_approved","deployed","rolled_back"],"manifest":"baseline-state-seed-20261024.json","provenance":{"config_hash":"83b78d453501c33415d8e834ea3f0d46d66aa44278ae2fb1e1f471f1f12e2b51","final_profile_hash":"75d9435dc2d28a231d3e860abb43689855149a35179c40ab492568d7b11d003d","split_seed":20271024,"training_examples_hash":"dfb8c623c0d1041f9c83af30dd5e501f46e008e2c5db9cabf0085df65be5c7ed","training_protocol":"observable-prefix-baselines.v1"},"schema_version":"baseline-state.v1"},"dataset_sequence_count":10000,"evaluation":{"bootstrap":{"cluster_count":1500,"intervals_95":{"global_frequency.accuracy":{"lower":0.197052164718522,"upper":0.20660648259377057},"global_frequency.macro_f1":{"lower":0.03658100345665895,"upper":0.038050973661180765},"logistic_minus_global_frequency.accuracy":{"lower":0.2068950838828775,"upper":0.2237567280180065},"logistic_minus_global_frequency.macro_f1":{"lower":0.27880725829864833,"upper":0.2938176835804776},"logistic_minus_markov.accuracy":{"lower":0.0014912577213323649,"upper":0.00989664430212192},"logistic_minus_markov.macro_f1":{"lower":0.02013689883196437,"upper":0.0322202083839058},"logistic_regression.accuracy":{"lower":0.4112201510107661,"upper":0.42410623768621253},"logistic_regression.macro_f1":{"lower":0.3159885294631275,"upper":0.33061577182059776},"markov.accuracy":{"lower":0.40463611340701383,"upper":0.41847962637303043},"markov.macro_f1":{"lower":0.29187250760254635,"upper":0.30325045874202206}},"replicates":200,"seed":20291024},"error_analysis":{"prefix_length_bands":{"count":9299,"examples":[],"groups":{"long":3627,"medium":3275,"short":2397}},"semantic_categories":{"count":9299,"examples":[],"groups":{"deployment_rollback_ambiguity":{"count":61,"examples":[{"confidence_margin":0.319684594441694,"example_key":"seq-003099:8","predicted":"rolled_back","prefix":["api_interface_modified","dependency_upgraded","ci_failed","dependency_upgraded","compatibility_checked","integration_test_passed","review_approved","deployed"],"prefix_length_band":"long","target":"deployed"},{"confidence_margin":0.31466383039110607,"example_key":"seq-007888:13","predicted":"rolled_back","prefix":["dependency_upgraded","integration_test_passed","review_approved","integration_test_passed","bug_fixed","ci_failed","ci_failed","bug_fixed","compatibility_checked","integration_test_passed","deployed","review_approved","deployed"],"prefix_length_band":"long","target":"deployed"},{"confidence_margin":0.2800010881109695,"example_key":"seq-008614:12","predicted":"rolled_back","prefix":["api_interface_modified","compatibility_checked","review_approved","api_interface_modified","api_interface_modified","api_interface_modified","api_interface_modified","compatibility_checked","ci_failed","bug_fixed","integration_test_passed","deployed"],"prefix_length_band":"long","target":"deployed"},{"confidence_margin":0.25381822272785054,"example_key":"seq-004251:13","predicted":"rolled_back","prefix":["dependency_upgraded","compatibility_checked","compatibility_checked","review_approved","ci_failed","compatibility_checked","bug_fixed","ci_failed","bug_fixed","ci_failed","bug_fixed","integration_test_passed","deployed"],"prefix_length_band":"long","target":"deployed"},{"confidence_margin":0.24001459427659588,"example_key":"seq-007178:13","predicted":"rolled_back","prefix":["api_interface_modified","integration_test_passed","review_approved","ci_failed","compatibility_checked","review_approved","integration_test_passed","review_approved","review_approved","deployed","bug_fixed","compatibility_checked","deployed"],"prefix_length_band":"long","target":"deployed"}]},"other":{"count":3144,"examples":[{"confidence_margin":0.7180858874124466,"example_key":"seq-002695:9","predicted":"deployed","prefix":["api_interface_modified","compatibility_checked","integration_test_passed","compatibility_checked","bug_fixed","compatibility_checked","integration_test_passed","compatibility_checked","review_approved"],"prefix_length_band":"long","target":"ci_failed"},{"confidence_margin":0.7125716684565666,"example_key":"seq-009447:6","predicted":"deployed","prefix":["dependency_upgraded","compatibility_checked","review_approved","compatibility_checked","compatibility_checked","review_approved"],"prefix_length_band":"medium","target":"api_interface_modified"},{"confidence_margin":0.7118109075760373,"example_key":"seq-007494:10","predicted":"deployed","prefix":["api_interface_modified","dependency_upgraded","compatibility_checked","compatibility_checked","review_approved","deployed","bug_fixed","integration_test_passed","compatibility_checked","review_approved"],"prefix_length_band":"long","target":"compatibility_checked"},{"confidence_margin":0.705981171454212,"example_key":"seq-003411:8","predicted":"deployed","prefix":["dependency_upgraded","compatibility_checked","integration_test_passed","bug_fixed","compatibility_checked","integration_test_passed","compatibility_checked","review_approved"],"prefix_length_band":"long","target":"ci_failed"},{"confidence_margin":0.7012774740318646,"example_key":"seq-001221:10","predicted":"deployed","prefix":["dependency_upgraded","compatibility_checked","ci_failed","review_approved","deployed","bug_fixed","integration_test_passed","bug_fixed","integration_test_passed","review_approved"],"prefix_length_band":"long","target":"api_interface_modified"}]},"post_failure_recovery":{"count":1157,"examples":[{"confidence_margin":0.5955267464885282,"example_key":"seq-007617:13","predicted":"bug_fixed","prefix":["dependency_upgraded","compatibility_checked","integration_test_passed","review_approved","deployed","bug_fixed","review_approved","deployed","ci_failed","dependency_upgraded","dependency_upgraded","compatibility_checked","ci_failed"],"prefix_length_band":"long","target":"compatibility_checked"},{"confidence_margin":0.5726328575532097,"example_key":"seq-007276:11","predicted":"bug_fixed","prefix":["api_interface_modified","dependency_upgraded","compatibility_checked","integration_test_passed","review_approved","deployed","ci_failed","ci_failed","api_interface_modified","compatibility_checked","ci_failed"],"prefix_length_band":"long","target":"compatibility_checked"},{"confidence_margin":0.5708032835852258,"example_key":"seq-000233:7","predicted":"bug_fixed","prefix":["api_interface_modified","compatibility_checked","integration_test_passed","review_approved","compatibility_checked","review_approved","ci_failed"],"prefix_length_band":"medium","target":"compatibility_checked"},{"confidence_margin":0.5636226009598804,"example_key":"seq-007374:12","predicted":"bug_fixed","prefix":["api_interface_modified","compatibility_checked","integration_test_passed","review_approved","deployed","deployed","bug_fixed","review_approved","deployed","ci_failed","compatibility_checked","ci_failed"],"prefix_length_band":"long","target":"compatibility_checked"},{"confidence_margin":0.559668760774163,"example_key":"seq-002944:6","predicted":"bug_fixed","prefix":["dependency_upgraded","compatibility_checked","integration_test_passed","review_approved","compatibility_checked","ci_failed"],"prefix_length_band":"medium","target":"compatibility_checked"}]},"rare_target":{"count":87,"examples":[{"confidence_margin":0.2454533196326492,"example_key":"seq-006309:5","predicted":"bug_fixed","prefix":["api_interface_modified","dependency_upgraded","integration_test_passed","ci_failed","deployed"],"prefix_length_band":"medium","target":"rolled_back"},{"confidence_margin":0.19835353947149031,"example_key":"seq-008482:12","predicted":"review_approved","prefix":["api_interface_modified","ci_failed","bug_fixed","compatibility_checked","bug_fixed","bug_fixed","compatibility_checked","integration_test_passed","compatibility_checked","integration_test_passed","deployed","deployed"],"prefix_length_band":"long","target":"rolled_back"},{"confidence_margin":0.19797666792153829,"example_key":"seq-007132:6","predicted":"api_interface_modified","prefix":["dependency_upgraded","dependency_upgraded","dependency_upgraded","compatibility_checked","review_approved","deployed"],"prefix_length_band":"medium","target":"rolled_back"},{"confidence_margin":0.1775600466193851,"example_key":"seq-000591:11","predicted":"bug_fixed","prefix":["api_interface_modified","ci_failed","bug_fixed","compatibility_checked","ci_failed","bug_fixed","compatibility_checked","integration_test_passed","ci_failed","api_interface_modified","deployed"],"prefix_length_band":"long","target":"rolled_back"},{"confidence_margin":0.17518574624571326,"example_key":"seq-008284:5","predicted":"review_approved","prefix":["api_interface_modified","integration_test_passed","compatibility_checked","integration_test_passed","deployed"],"prefix_length_band":"medium","target":"rolled_back"}]},"readiness_ambiguity":{"count":5180,"examples":[{"confidence_margin":0.7157351348804053,"example_key":"seq-003186:11","predicted":"deployed","prefix":["api_interface_modified","compatibility_checked","bug_fixed","review_approved","integration_test_passed","review_approved","ci_failed","review_approved","compatibility_checked","bug_fixed","review_approved"],"prefix_length_band":"long","target":"integration_test_passed"},{"confidence_margin":0.7102629678633278,"example_key":"seq-004886:10","predicted":"deployed","prefix":["api_interface_modified","compatibility_checked","integration_test_passed","review_approved","compatibility_checked","integration_test_passed","review_approved","compatibility_checked","deployed","review_approved"],"prefix_length_band":"long","target":"review_approved"},{"confidence_margin":0.6970275889562525,"example_key":"seq-004134:11","predicted":"deployed","prefix":["api_interface_modified","